{
  "$schema": "./obs-capabilities-v1.schema.json",
  "schema_version": "1.0",
  "product": "dcc-mcp-obs",
  "first_slice_issue": "https://github.com/dcc-mcp/dcc-mcp-obs/issues/1",
  "live_acceptance": {
    "status": "not_run",
    "tracking_issue": "https://github.com/dcc-mcp/dcc-mcp-obs/issues/4"
  },
  "domains": [
    {
      "domain": "status",
      "status": "partial",
      "authority": "native_plugin",
      "delivered_operations": ["get_plugin_status", "get_obs_identity", "get_event_sequence", "get_operator_status"],
      "remaining_operations": ["get_output_statistics", "get_dropped_frame_statistics"],
      "dangerous_operations": [],
      "tracking_issue": "https://github.com/dcc-mcp/dcc-mcp-obs/issues/2"
    },
    {
      "domain": "scenes",
      "status": "delivered",
      "authority": "native_plugin",
      "delivered_operations": ["list_scenes", "get_current_scene", "switch_scene", "create_scene", "rename_scene", "remove_scene"],
      "remaining_operations": [],
      "dangerous_operations": ["switch_scene", "create_scene", "rename_scene", "remove_scene"],
      "tracking_issue": "https://github.com/dcc-mcp/dcc-mcp-obs/issues/6"
    },
    {
      "domain": "scene_items",
      "status": "delivered",
      "authority": "native_plugin",
      "delivered_operations": ["list_scene_items", "create_scene_item", "set_scene_item_enabled", "set_scene_item_transform", "remove_scene_item"],
      "remaining_operations": [],
      "dangerous_operations": ["create_scene_item", "set_scene_item_enabled", "set_scene_item_transform", "remove_scene_item"],
      "tracking_issue": "https://github.com/dcc-mcp/dcc-mcp-obs/issues/6"
    },
    {
      "domain": "sources",
      "status": "delivered",
      "authority": "native_plugin",
      "delivered_operations": ["list_sources", "get_source_identity", "create_source", "rename_source", "remove_source", "list_window_capture_candidates", "restore_window_capture_candidate", "create_window_capture_source", "get_window_capture_source", "rebind_window_capture_source", "set_window_capture_method", "set_window_capture_audio"],
      "remaining_operations": [],
      "dangerous_operations": ["restore_window_capture_candidate", "create_window_capture_source", "rebind_window_capture_source", "set_window_capture_method", "set_window_capture_audio", "create_source", "rename_source", "remove_source"],
      "tracking_issue": "https://github.com/dcc-mcp/dcc-mcp-obs/issues/5"
    },
    {
      "domain": "inputs",
      "status": "delivered",
      "authority": "native_plugin",
      "delivered_operations": ["list_input_kinds", "get_input_settings", "set_input_settings", "list_window_capture_candidates", "restore_window_capture_candidate", "create_window_capture_source", "get_window_capture_source", "rebind_window_capture_source", "set_window_capture_method", "set_window_capture_audio"],
      "remaining_operations": [],
      "dangerous_operations": ["restore_window_capture_candidate", "create_window_capture_source", "rebind_window_capture_source", "set_window_capture_method", "set_window_capture_audio", "set_input_settings"],
      "tracking_issue": "https://github.com/dcc-mcp/dcc-mcp-obs/issues/5"
    },
    {
      "domain": "agent_input_overlay",
      "status": "delivered",
      "authority": "native_plugin",
      "delivered_operations": ["get_agent_input_overlay", "create_agent_input_overlay", "set_agent_input_overlay_layout", "emit_agent_input_activity", "clear_agent_input_overlay"],
      "remaining_operations": [],
      "dangerous_operations": ["create_agent_input_overlay", "set_agent_input_overlay_layout", "emit_agent_input_activity", "clear_agent_input_overlay"],
      "tracking_issue": "https://github.com/dcc-mcp/dcc-mcp-obs/issues/5"
    },
    {
      "domain": "properties",
      "status": "delivered",
      "authority": "native_plugin",
      "delivered_operations": ["describe_properties", "validate_property_value", "set_property_value"],
      "remaining_operations": [],
      "dangerous_operations": ["set_property_value"],
      "tracking_issue": "https://github.com/dcc-mcp/dcc-mcp-obs/issues/5"
    },
    {
      "domain": "filters",
      "status": "delivered",
      "authority": "native_plugin",
      "delivered_operations": ["list_filters", "get_filter", "create_filter", "set_filter_enabled", "set_filter_settings", "remove_filter"],
      "remaining_operations": [],
      "dangerous_operations": ["create_filter", "set_filter_enabled", "set_filter_settings", "remove_filter"],
      "tracking_issue": "https://github.com/dcc-mcp/dcc-mcp-obs/issues/5"
    },
    {
      "domain": "audio",
      "status": "delivered",
      "authority": "native_plugin",
      "delivered_operations": ["get_source_volume", "set_source_volume", "get_source_mute", "set_source_mute", "get_source_monitor_type", "set_source_monitor_type", "set_window_capture_audio"],
      "remaining_operations": [],
      "dangerous_operations": ["set_source_volume", "set_source_mute", "set_source_monitor_type", "set_window_capture_audio"],
      "tracking_issue": "https://github.com/dcc-mcp/dcc-mcp-obs/issues/5"
    },
    {
      "domain": "transitions",
      "status": "delivered",
      "authority": "native_plugin",
      "delivered_operations": ["list_transitions", "get_current_transition", "set_current_transition", "trigger_transition"],
      "remaining_operations": [],
      "dangerous_operations": ["set_current_transition", "trigger_transition"],
      "tracking_issue": "https://github.com/dcc-mcp/dcc-mcp-obs/issues/6"
    },
    {
      "domain": "studio_mode",
      "status": "delivered",
      "authority": "native_plugin",
      "delivered_operations": ["get_studio_mode", "set_studio_mode", "get_preview_scene", "set_preview_scene", "transition_to_program"],
      "remaining_operations": [],
      "dangerous_operations": ["set_studio_mode", "set_preview_scene", "transition_to_program"],
      "tracking_issue": "https://github.com/dcc-mcp/dcc-mcp-obs/issues/6"
    },
    {
      "domain": "profiles",
      "status": "delivered",
      "authority": "native_plugin",
      "delivered_operations": ["list_profiles", "get_current_profile", "set_current_profile"],
      "remaining_operations": [],
      "dangerous_operations": ["set_current_profile"],
      "tracking_issue": "https://github.com/dcc-mcp/dcc-mcp-obs/issues/3"
    },
    {
      "domain": "scene_collections",
      "status": "delivered",
      "authority": "native_plugin",
      "delivered_operations": ["list_scene_collections", "get_current_scene_collection", "set_current_scene_collection"],
      "remaining_operations": [],
      "dangerous_operations": ["set_current_scene_collection"],
      "tracking_issue": "https://github.com/dcc-mcp/dcc-mcp-obs/issues/3"
    },
    {
      "domain": "recording",
      "status": "delivered",
      "authority": "native_plugin",
      "delivered_operations": ["get_recording_status", "start_recording", "stop_recording", "pause_recording", "resume_recording", "get_scene_recording_session", "start_scene_recordings", "stop_scene_recordings"],
      "remaining_operations": [],
      "dangerous_operations": ["start_recording", "stop_recording", "pause_recording", "resume_recording", "start_scene_recordings", "stop_scene_recordings"],
      "tracking_issue": "https://github.com/dcc-mcp/dcc-mcp-obs/issues/1"
    },
    {
      "domain": "replay_buffer",
      "status": "delivered",
      "authority": "native_plugin",
      "delivered_operations": ["get_replay_buffer_status", "start_replay_buffer", "stop_replay_buffer", "save_replay_buffer"],
      "remaining_operations": [],
      "dangerous_operations": ["start_replay_buffer", "stop_replay_buffer", "save_replay_buffer"],
      "tracking_issue": "https://github.com/dcc-mcp/dcc-mcp-obs/issues/2"
    },
    {
      "domain": "streaming",
      "status": "delivered",
      "authority": "native_plugin",
      "delivered_operations": ["get_streaming_status", "start_streaming", "stop_streaming"],
      "remaining_operations": [],
      "dangerous_operations": ["start_streaming", "stop_streaming"],
      "tracking_issue": "https://github.com/dcc-mcp/dcc-mcp-obs/issues/2"
    },
    {
      "domain": "virtual_camera",
      "status": "delivered",
      "authority": "native_plugin",
      "delivered_operations": ["get_virtual_camera_status", "start_virtual_camera", "stop_virtual_camera"],
      "remaining_operations": [],
      "dangerous_operations": ["start_virtual_camera", "stop_virtual_camera"],
      "tracking_issue": "https://github.com/dcc-mcp/dcc-mcp-obs/issues/2"
    },
    {
      "domain": "media",
      "status": "delivered",
      "authority": "native_plugin",
      "delivered_operations": ["get_media_status", "play_media", "pause_media", "restart_media", "stop_media", "seek_media"],
      "remaining_operations": [],
      "dangerous_operations": ["play_media", "pause_media", "restart_media", "stop_media", "seek_media"],
      "tracking_issue": "https://github.com/dcc-mcp/dcc-mcp-obs/issues/5"
    },
    {
      "domain": "outputs",
      "status": "delivered",
      "authority": "native_plugin",
      "delivered_operations": ["list_outputs", "get_output_status", "start_output", "stop_output", "get_scene_recording_session", "start_scene_recordings", "stop_scene_recordings"],
      "remaining_operations": [],
      "dangerous_operations": ["start_output", "stop_output", "start_scene_recordings", "stop_scene_recordings"],
      "tracking_issue": "https://github.com/dcc-mcp/dcc-mcp-obs/issues/2"
    },
    {
      "domain": "hotkeys",
      "status": "delivered",
      "authority": "native_plugin",
      "delivered_operations": ["list_allowlisted_hotkeys", "trigger_allowlisted_hotkey"],
      "remaining_operations": [],
      "dangerous_operations": ["trigger_allowlisted_hotkey"],
      "tracking_issue": "https://github.com/dcc-mcp/dcc-mcp-obs/issues/3"
    },
    {
      "domain": "screenshots",
      "status": "partial",